{
  "$schema": "https://synthhub.roomi-fields.com/osd/0.3/sound.schema.json",
  "name": "Warm pad",
  "kind": "sound",
  "device": { "descriptor": "korg/minilogue", "vendor": "KORG", "model": "minilogue" },
  "content": {
    "settings": { "/amp/attack": [90], "/amp/release": [100], "/filter/cutoff": [64] }
  },
  "author": { "name": "Example Author", "url": "https://example.org" },
  "license": "CC0-1.0",
  "category": "pad",
  "genres": ["ambient"],
  "tips": "Hold chords; the mod wheel opens the filter.",
  "version": 1,
  "published": "2026-10-27T12:00:00Z"
}
